"48STXWQB","journalArticle","2004","Neu, Peter; Kühn, Reimer","Credit risk enhancement in a network of interdependent firms","Physica A: Statistical Mechanics and its Applications","","03784371","10.1016/j.physa.2004.05.062","https://linkinghub.elsevier.com/retrieve/pii/S0378437104007113","We generalize existing structural models for credit risk to capture the impact of counterparty defaults on economic capital allocated to banks’ loan portfolios. Exploring the analogy to a lattice gas model from physics, correlations between sequential defaults are modeled as due to functionally deÿned, heterogeneous couplings between mutually dependent counterparties. We show that—already for moderate micro-economic dependencies—counterparty risk results in a fattening of the tails in the portfolio loss distribution. In particular, for stronger mutually supportive relationship between the ÿrms, collective phenomena such as bursts and avalanches of defaults can be observed in the model. In this context, traditional credit risk models are inadequate because they underestimate the required capital bu er. Our model setting is particularly applicable for doing stress analyses of credit risk in loan portfolios.","2004-11","2024-02-05 13:50:50","2024-02-05 13:50:51","2024-02-05 13:50:50","639-655","","3-4","342","","Physica A: Statistical Mechanics and its Applications","","","","","","","","en","","","","","DOI.org (Crossref)","","","","C:\Users\maroa\Zotero\storage\YD9LBRK2\Neu and Kühn - 2004 - Credit risk enhancement in a network of interdepen.pdf","","","","","","","","","","","","","","","","","","","","","","","","","","","","","","","","","","","","","","","","","","","","","","","","",""
"6CFCKTF9","journalArticle","2006","Hatchett, J. P. L.; Kühn, R.","Effects of economic interactions on credit risk","Journal of Physics A: Mathematical and General","","0305-4470","10.1088/0305-4470/39/10/001","https://dx.doi.org/10.1088/0305-4470/39/10/001","We study a credit-risk model which captures effects of economic interactions on a firm's default probability. Economic interactions are represented as a functionally defined graph, and the existence of both cooperative and competitive business relations is taken into account. We provide an analytic solution of the model in a limit where the number of business relations of each company is large, but the overall fraction of the economy with which a given company interacts may be small. While the effects of economic interactions are relatively weak in typical (most probable) scenarios, they are pronounced in situations of economic stress, and thus lead to a substantial fattening of the tails of loss distributions in large loan portfolios. This manifests itself in a pronounced enhancement of the value at risk computed for interacting economies in comparison with their non-interacting counterparts.","2006-02","2024-02-05 13:52:40","2024-02-05 13:52:40","2024-02-05 13:52:40","2231","","10","39","","J. Phys. A: Math. Gen.","","","","","","","","en","","","","","Institute of Physics","","","","C:\Users\maroa\Zotero\storage\3IPTQJ3R\Hatchett and Kühn - 2006 - Effects of economic interactions on credit risk.pdf","","","","","","","","","","","","","","","","","","","","","","","","","","","","","","","","","","","","","","","","","","","","","","","","",""
"YQ67R6CD","journalArticle","2009","Hatchett, J. P. L.; Kühn, R.","Credit contagion and credit risk","Quantitative Finance","","1469-7688","10.1080/14697680802464162","https://doi.org/10.1080/14697680802464162","","2009-06-01","2024-02-05 13:53:02","2024-02-05 13:53:02","2024-02-05 13:53:02","373-382","","4","9","","","","","","","","","","","","","","","Taylor and Francis+NEJM","","Publisher: Routledge _eprint: https://doi.org/10.1080/14697680802464162","","C:\Users\maroa\Zotero\storage\5ZRFUSF6\Hatchett and Kühn - 2009 - Credit contagion and credit risk.pdf","","","","","","","","","","","","","","","","","","","","","","","","","","","","","","","","","","","","","","","","","","","","","","","","",""
"S468PD8J","journalArticle","2017","Gandy, Axel; Veraart, Luitgard A. M.","A Bayesian Methodology for Systemic Risk Assessment in Financial Networks","Management Science","","0025-1909","10.1287/mnsc.2016.2546","https://pubsonline.informs.org/doi/10.1287/mnsc.2016.2546","We develop a Bayesian methodology for systemic risk assessment in financial networks such as the interbank market. Nodes represent participants in the network, and weighted directed edges represent liabilities. Often, for every participant, only the total liabilities and total assets within this network are observable. However, systemic risk assessment needs the individual liabilities. We propose a model for the individual liabilities, which, following a Bayesian approach, we then condition on the observed total liabilities and assets and, potentially, on certain observed individual liabilities. We construct a Gibbs sampler to generate samples from this conditional distribution. These samples can be used in stress testing, giving probabilities for the outcomes of interest. As one application we derive default probabilities of individual banks and discuss their sensitivity with respect to prior information included to model the network. An R package implementing the methodology is provided. This paper was accepted by Noah Gans, stochastic models and simulation.","2017-12","2024-02-10 19:42:33","2024-02-10 19:42:34","2024-02-10 19:42:33","4428-4446","","12","63","","","","","","","","","","","","","","","pubsonline.informs.org (Atypon)","","Publisher: INFORMS","","C:\Users\maroa\Zotero\storage\IKPQ6SRW\Gandy and Veraart - 2017 - A Bayesian Methodology for Systemic Risk Assessmen.pdf","","","systemic risk; Bayes; financial network; Gibbs sampler; MCMC; power law; unknown interbank liabilities","","","","","","","","","","","","","","","","","","","","","","","","","","","","","","","","","","","","","","","","","","","","","",""
"DC8DMCE9","journalArticle","2018","Braverman, Anton; Minca, Andreea","Networks of common asset holdings: aggregation and measures of vulnerability","Journal of Network Theory in Finance","","","","https://www.risk.net/journal-of-network-theory-in-finance/5883201/networks-of-common-asset-holdings-aggregation-and-measures-of-vulnerability","This paper quantifies the interrelations induced among financial institutions by common asset holdings.","2018-08-22","2024-02-10 19:55:00","2024-02-10 19:57:56","2024-02-10 19:55:00","","","","","","","Networks of common asset holdings","","","","","","","en","","","","","www.risk.net","","","","C:\Users\maroa\Zotero\storage\Q3RY3MDS\Braverman and Minca - Networks of Common Asset Holdings Aggregation and.pdf","","","","","","","","","","","","","","","","","","","","","","","","","","","","","","","","","","","","","","","","","","","","","","","","",""
"RHHKAYJS","journalArticle","2005","Kaplow, Louis","Pareto Principle and Competing Principles","The Harvard John M. Olin Discussion Paper Series","","1045-6333","","","The Pareto principle, the seemingly incontrovertible dictum that if all individuals prefer some regime to another then so should society, may conflict with competing principles. Arrow’s impossibility theorem and Sen’s liberal paradox are two notable examples. Subsequent work indicates more broadly that the Pareto principle conflicts with all nonwelfarist principles. This essay surveys these results, including various extensions thereof, and offers perspectives on the conflict, drawing on classical and contemporary work in political economy and economic psychology.","2005-08","2024-02-10 20:46:18","2024-02-11 01:17:21","","","","Discussion Paper No. 519","2005","","","","","","","","","","en","","","","","Zotero","","","","C:\Users\maroa\Zotero\storage\SUUV6VK8\Kaplow_519.pdf","","","","","","","","","","","","","","","","","","","","","","","","","","","","","","","","","","","","","","","","","","","","","","","","",""
"GK5EWEKE","journalArticle","2010","Berge, Tor Oddvar","Operational problems in banks – Effects on the settlement of payments in Norges Bank","ECONOMIC BULLETIN 2012","","","","","We analyse the robustness of the settlement process in the Norges Bank settlement system (NBO) to operational problems in one of its participating banks. The analysis is based on a large number of simulations using actual payments data. We find that of the 21 banks directly participating in NBO, only four are of systemic importance in the sense that their inability to send payments would have a significant effect on the other banks in the system. Moreover, the level of such systemic risk varies substantially, depending on the liquidity available to individual banks and on overall activity in the system. On most days, the systemic effects would be limited due to benign liquidity conditions in the system. Furthermore, we find that the systemic effects can be significantly reduced if banks react quickly by postponing their outgoing payments to the stricken bank.","2010","2024-02-10 21:01:07","2024-02-10 22:08:09","","36–47","","","83","","","","","","","","","","en","","","","","Zotero","","","","C:\Users\maroa\Zotero\storage\NHDMHYRI\Berge - 2010 - Operational problems in banks – Effects on the set.pdf","","","","","","","","","","","","","","","","","","","","","","","","","","","","","","","","","","","","","","","","","","","","","","","","",""
"TEAEF4TU","bookSection","2013","McLafferty, Joanna; Denbee, Edward","Liquidity Saving in CHAPS: A Simulation Study","Simulation in Computational Finance and Economics: Tools and Emerging Applications","978-1-4666-2011-7","","","https://www.igi-global.com/chapter/content/www.igi-global.com/chapter/content/68694","This study uses a simulation methodology and real payment data to quantify the liquidity efficiency that could be obtained in CHAPS, the UK’s large-value payment system, by the implementation of a Liquidity Saving Mechanism (LSM). The payment data comes from payments submitted to CHAPS and, as such,...","2013","2024-02-10 21:04:28","2024-02-10 21:04:28","2024-02-10 21:04:28","120-142","","","","","","Liquidity Saving in CHAPS","","","","","IGI Global","","en","Access limited to members","","","","www.igi-global.com","","DOI: 10.4018/978-1-4666-2011-7.ch007","","","","","","","","","","","","","","","","","","","","","","","","","","","","","","","","","","","","","","","","","","","","","","","","","","",""
"7KJUY8FB","journalArticle","2013","Finger, Karl; Fricke, Daniel; Lux, Thomas","Network analysis of the e-MID overnight money market: the informational value of different aggregation levels for intrinsic dynamic processes","Computational Management Science","","1619-6988","10.1007/s10287-013-0171-9","https://doi.org/10.1007/s10287-013-0171-9","In this paper, we analyze the network properties of the Italian e-MID data based on overnight loans during the period 1999–2010. We show that the networks appear to be random at the daily level, but contain significant non-random structure for longer aggregation periods. In this sense, the daily networks cannot be considered as being representative for the underlying ‘latent’ network. Rather, the development of various network statistics under time aggregation points toward strong non-random determinants of link formation. We also identify the global financial crisis as a significant structural break for many network measures.","2013-06-01","2024-02-10 21:25:18","2024-02-10 21:25:20","2024-02-10 21:25:18","187-211","","2","10","","Comput Manag Sci","Network analysis of the e-MID overnight money market","","","","","","","en","","","","","Springer Link","","","","C:\Users\maroa\Zotero\storage\QNM6GG8Y\Finger et al. - 2013 - Network analysis of the e-MID overnight money mark.pdf","","","Financial crisis; Interbank market; Network models","","","","","","","","","","","","","","","","","","","","","","","","","","","","","","","","","","","","","","","","","","","","","",""
"EWYMW8NS","journalArticle","2014","Xu, K.S.; Hero III, A.O.","Dynamic stochastic blockmodels for time-evolving social networks","IEEE Journal on Selected Topics in Signal Processing","","1932-4553","10.1109/JSTSP.2014.2310294","","Significant efforts have gone into the development of statistical models for analyzing data in the form of networks, such as social networks. Most existing work has focused on modeling static networks, which represent either a single time snapshot or an aggregate view over time. There has been recent interest in statistical modeling of dynamic networks, which are observed at multiple points in time and offer a richer representation of many complex phenomena. In this paper, we present a state-space model for dynamic networks that extends the well-known stochastic blockmodel for static networks to the dynamic setting. We fit the model in a near-optimal manner using an extended Kalman filter (EKF) augmented with a local search. We demonstrate that the EKF-based algorithm performs competitively with a state-of-the-art algorithm based on Markov chain Monte Carlo sampling but is significantly less computationally demanding. © 2007-2012 IEEE.","2014","2024-02-10 21:56:00","2024-02-10 21:56:02","","552-562","","4","8","","","","","","","","","","English","","","Scopus","","Scopus","","","","C:\Users\maroa\Zotero\storage\X463K4LD\Xu and Hero III - 2014 - Dynamic stochastic blockmodels for time-evolving s.pdf","","","dynamic network; extended Kalman filter; on-line estimation; State-space social network model","","","","","","","","","","","","","","","","","","","","","","","","","","","","","","","","","","","","","","","","","","","","","",""
"UHPM7M2J","journalArticle","2009","Diebold, Francis X.; Yilmaz, Kamil","Measuring Financial Asset Return and Volatility Spillovers, with Application to Global Equity Markets","The Economic Journal","","0013-0133","10.1111/j.1468-0297.2008.02208.x","https://doi.org/10.1111/j.1468-0297.2008.02208.x","We provide a simple and intuitive measure of interdependence of asset returns and/or volatilities. In particular, we formulate and examine precise and separate measures of return spillovers and volatility spillovers. Our framework facilitates study of both non‐crisis and crisis episodes, including trends and bursts in spillovers; both turn out to be empirically important. In particular, in an analysis of 19 global equity markets from the early 1990s to the present, we find striking evidence of divergent behaviour in the dynamics of return spillovers vs. volatility spillovers: return spillovers display a gently increasing trend but no bursts, whereas volatility spillovers display no trend but clear bursts.","2009-01-01","2024-02-11 00:03:20","2024-02-11 00:03:21","2024-02-11 00:03:20","158-171","","534","119","","The Economic Journal","","","","","","","","","","","","","Silverchair","","","","C:\Users\maroa\Zotero\storage\A53MMCVT\Diebold and Yilmaz - 2009 - Measuring Financial Asset Return and Volatility Sp.pdf","","","","","","","","","","","","","","","","","","","","","","","","","","","","","","","","","","","","","","","","","","","","","","","","",""
"VY5PZBFH","journalArticle","2019","Greenwood-Nimmo, Matthew; Huang, Jingong; Nguyen, Viet Hoang","Financial sector bailouts, sovereign bailouts, and the transfer of credit risk","Journal of Financial Markets","","1386-4181","10.1016/j.finmar.2018.11.001","https://www.sciencedirect.com/science/article/pii/S1386418116303408","We develop an empirical network model to study credit risk spillovers among a group of eighteen sovereigns and their financial sectors from 2006 to 2015. Initially a net source of credit risk, the financial sector becomes a net recipient after the 2008 financial sector bailouts in many countries. Fiscal fundamentals explain much of the heterogeneity in financial-sovereign spillovers over this period. The subsequent European sovereign bailouts disrupt the feedback between sovereign risk and local financial sector risk. Depending on the initial fiscal position of the target country, sovereign bailouts may also disrupt international credit risk spillovers originating from the target sovereign.","2019-01-01","2024-02-11 00:11:17","2024-02-11 00:11:17","2024-02-11 00:11:17","121-142","","","42","","Journal of Financial Markets","","","","","","","","","","","","","ScienceDirect","","","","C:\Users\maroa\Zotero\storage\DF2DC6PL\Greenwood-Nimmo et al. - 2019 - Financial sector bailouts, sovereign bailouts, and.pdf","","","Financial crisis; Credit risk transmission; Debt crisis; Financial–sovereign linkages; Network modeling","","","","","","","","","","","","","","","","","","","","","","","","","","","","","","","","","","","","","","","","","","","","","",""
"IT5W7JIL","journalArticle","2014","Acharya, Viral; Drechsler, Itamar; Schnabl, Philipp","A Pyrrhic Victory? Bank Bailouts and Sovereign Credit Risk","The Journal of Finance","","1540-6261","10.1111/jofi.12206","https://onlinelibrary.wiley.com/doi/abs/10.1111/jofi.12206","We model a loop between sovereign and bank credit risk. A distressed financial sector induces government bailouts, whose cost increases sovereign credit risk. Increased sovereign credit risk in turn weakens the financial sector by eroding the value of its government guarantees and bond holdings. Using credit default swap (CDS) rates on European sovereigns and banks, we show that bailouts triggered the rise of sovereign credit risk in 2008. We document that post-bailout changes in sovereign CDS explain changes in bank CDS even after controlling for aggregate and bank-level determinants of credit spreads, confirming the sovereign-bank loop.","2014","2024-02-11 00:12:15","2024-02-11 00:12:15","2024-02-11 00:12:15","2689-2739","","6","69","","","A Pyrrhic Victory?","","","","","","","en","© 2014 the American Finance Association","","","","Wiley Online Library","","_eprint: https://onlinelibrary.wiley.com/doi/pdf/10.1111/jofi.12206","","C:\Users\maroa\Zotero\storage\LD6PYATN\Acharya et al. - 2014 - A Pyrrhic Victory Bank Bailouts and Sovereign Cre.pdf","","","","","","","","","","","","","","","","","","","","","","","","","","","","","","","","","","","","","","","","","","","","","","","","",""
"77F4MLZU","journalArticle","2012","Kantar, Ersin; Keskin, Mustafa; Deviren, Bayram","Analysis of the effects of the global financial crisis on the Turkish economy, using hierarchical methods","Physica A: Statistical Mechanics and its Applications","","0378-4371","10.1016/j.physa.2011.12.014","https://www.sciencedirect.com/science/article/pii/S0378437111009113","We have analyzed the topology of 50 important Turkish companies for the period 2006–2010 using the concept of hierarchical methods (the minimal spanning tree (MST) and hierarchical tree (HT)). We investigated the statistical reliability of links between companies in the MST by using the bootstrap technique. We also used the average linkage cluster analysis (ALCA) technique to observe the cluster structures much better. The MST and HT are known as useful tools to perceive and detect global structure, taxonomy, and hierarchy in financial data. We obtained four clusters of companies according to their proximity. We also observed that the Banks and Holdings cluster always forms in the centre of the MSTs for the periods 2006–2007, 2008, and 2009–2010. The clusters match nicely with their common production activities or their strong interrelationship. The effects of the Automobile sector increased after the global financial crisis due to the temporary incentives provided by the Turkish government. We find that Turkish companies were not very affected by the global financial crisis.","2012-04-01","2024-02-11 00:29:24","2024-02-11 00:29:24","2024-02-11 00:29:24","2342-2352","","7","391","","Physica A: Statistical Mechanics and its Applications","","","","","","","","","","","","","ScienceDirect","","","","C:\Users\maroa\Zotero\storage\9EMVMUMF\Kantar et al. - 2012 - Analysis of the effects of the global financial cr.pdf","","","Stock market; Bootstrap technique; Correlation networks; Global financial crisis; Hierarchical methods","","","","","","","","","","","","","","","","","","","","","","","","","","","","","","","","","","","","","","","","","","","","","",""
"4LG4R4A2","journalArticle","2011","Namaki, A.; Shirazi, A.H.; Raei, R.; Jafari, G.R.","Network analysis of a financial market based on genuine correlation and threshold method","Physica A: Statistical Mechanics and its Applications","","0378-4371","10.1016/j.physa.2011.06.033","","A financial market is an example of an adaptive complex network consisting of many interacting units. This network reflects market's behavior. In this paper, we use Random Matrix Theory (RMT) notion for specifying the largest eigenvector of correlation matrix as the market mode of stock network. For a better risk management, we clean the correlation matrix by removing the market mode from data and then construct this matrix based on the residuals. We show that this technique has an important effect on correlation coefficient distribution by applying it for Dow Jones Industrial Average (DJIA). To study the topological structure of a network we apply the removing market mode technique and the threshold method to Tehran Stock Exchange (TSE) as an example. We show that this network follows a power-law model in certain intervals. We also show the behavior of clustering coefficients and component numbers of this network for different thresholds. These outputs are useful for both theoretical and practical purposes such as asset allocation and risk management. © 2011 Elsevier B.V. All rights reserved.","2011","2024-02-11 00:30:27","2024-02-11 00:30:27","","3835-3841","","21-22","390","","","","","","","","","","English","","","Scopus","","Scopus","","","","C:\Users\maroa\Zotero\storage\PFCPWDCD\Namaki et al. - 2011 - Network analysis of a financial market based on ge.pdf","","","Random Matrix Theory; Stock correlation network; Topological structure","","","","","","","","","","","","","","","","","","","","","","","","","","","","","","","","","","","","","","","","","","","","","",""
"CLTCIPG6","journalArticle","2005","Boginski, Vladimir; Butenko, Sergiy; Pardalos, Panos M.","Statistical analysis of financial networks","Computational Statistics & Data Analysis","","0167-9473","10.1016/j.csda.2004.02.004","https://www.sciencedirect.com/science/article/pii/S0167947304000258","Massive datasets arise in a broad spectrum of scientific, engineering and commercial applications. In many practically important cases, a massive dataset can be represented as a very large graph with certain attributes associated with its vertices and edges. Studying the structure of this graph is essential for understanding the structural properties of the application it represents. Well-known examples of applying this approach are the Internet graph, the Web graph, and the Call graph. It turns out that the degree distributions of all these graphs can be described by the power-law model. Here we consider another important application—a network representation of the stock market. Stock markets generate huge amounts of data, which can be used for constructing the market graph reflecting the market behavior. We conduct the statistical analysis of this graph and show that it also follows the power-law model. Moreover, we detect cliques and independent sets in this graph. These special formations have a clear practical interpretation, and their analysis allows one to apply a new data mining technique of classifying financial instruments based on stock prices data, which provides a deeper insight into the internal structure of the stock market.","2005-02-01","2024-02-11 00:39:01","2024-02-11 00:39:34","2024-02-11 00:39:01","431-443","","2","48","","Computational Statistics & Data Analysis","","","","","","","","","","","","","ScienceDirect","","","","C:\Users\maroa\Zotero\storage\6YYNW7GV\Boginski et al. - 2005 - Statistical analysis of financial networks.pdf","","","Degree distribution; Clique; Classification; Clustering coefficient; Cross-correlation; Data analysis; Diversified portfolio; Graph theory; Independent set; Market graph; Power-law model; Stock price fluctuations","","","","","","","","","","","","","","","","","","","","","","","","","","","","","","","","","","","","","","","","","","","","","",""
"IXVD9Q57","journalArticle","2002","Kullmann, L.; Kertész, J.; Kaski, K.","Time-dependent cross-correlations between different stock returns: A directed network of influence","Physical Review E","","","10.1103/PhysRevE.66.026125","https://link.aps.org/doi/10.1103/PhysRevE.66.026125","We study the time-dependent cross-correlations of stock returns, i.e., we measure the correlation as the function of the time shift between pairs of stock return time series using tick-by-tick data. We find a weak but significant effect showing that in many cases the maximum correlation appears at nonzero time shift, indicating directions of influence between the companies. Due to the weakness of this effect and the shortness of the characteristic time (of the order of a few minutes), our findings are compatible with market efficiency. The interaction of companies defines a directed network of influence.","2002-08-28","2024-02-11 00:41:57","2024-02-11 00:41:57","2024-02-11 00:41:57","026125","","2","66","","Phys. Rev. E","Time-dependent cross-correlations between different stock returns","","","","","","","","","","","","APS","","Publisher: American Physical Society","","C:\Users\maroa\Zotero\storage\KR6AT5XQ\Kullmann et al. - 2002 - Time-dependent cross-correlations between differen.pdf","","","","","","","","","","","","","","","","","","","","","","","","","","","","","","","","","","","","","","","","","","","","","","","","",""
