"MUMKM97N","conferencePaper","2021","Ying, Jiaxi; de M. Cardoso, José Vinícius; Palomar, Daniel P.","A Fast Algorithm for Graph Learning under Attractive Gaussian Markov Random Fields","2021 55th Asilomar Conference on Signals, Systems, and Computers","","","10.1109/IEEECONF53345.2021.9723090","https://ieeexplore.ieee.org/document/9723090","We consider the problem of graph learning under Gaussian Markov random fields, where all partial correlations are nonnegative. Such model is called attractive Gaussian Markov random fields, and has received considerable attention in recent years. The graph learning problem under this model can be formulated as the ℓ1-norm regularized Gaussian maximum likelihood estimation of the precision matrix under sign constraints. In this paper, we propose a projected Newton-like algorithm, which is computationally efficient. By exploiting the structure of the Gaussian maximum likelihood estimation problem, the proposed algorithm significantly reduces the computational cost in computing the approximate Newton direction. Then we prove that the proposed method can recover the graph edges correctly under the irrepresentability condition. Numerical results on synthetic and financial time-series data sets demonstrate the effectiveness of the proposed method.","2021-10","2023-11-01 21:07:10","2024-01-09 23:19:11","2023-11-01 21:07:10","1520-1524","","","","","","","","","","","","","","","","","","IEEE Xplore","","ISSN: 2576-2303","","C:\Users\maroa\Zotero\storage\SYZTFGQ5\9723090.html; C:\Users\maroa\Zotero\storage\CII3VHLE\Ying et al. - 2021 - A Fast Algorithm for Graph Learning under Attracti.pdf; ","notion://www.notion.so/Ying-et-al-2021-f26d1ff0725d49528083fc1a67bef4c4","notion","","","","","","","","","","","","","","","","","","","","","","","","","","","","","","","","2021 55th Asilomar Conference on Signals, Systems, and Computers","","","","","","","","","","","","","","",""
"SF4LSDNQ","journalArticle","2020","Türkmen, Ali Caner; Çapan, Gökhan; Cemgil, Ali Taylan","Clustering Event Streams With Low Rank Hawkes Processes","IEEE Signal Processing Letters","","1558-2361","10.1109/LSP.2020.3019964","https://ieeexplore.ieee.org/document/9178953","We introduce a fast algorithm for parameter estimation in multidimensional Hawkes processes, a widely used class of temporal point processes for mutually exciting discrete event data. Our approach assumes a low-rank structure on the infectivity parameter of the multidimensional Hawkes process, and relies on a method of moments estimator. Notably, it requires only a single scan of the data, and consistently recovers an accurate representation of the underlying graph structure, while sidestepping numerical stability issues inherent in Hawkes process estimation. Finally, we make connections between our method and spectral clustering, and observe that our contributions result in natural methods for clustering temporal point processes. Our algorithm can be used for community detection and graph cluster discovery in large networks of asynchronous event streams such as high-dimensional neural spike trains, log streams of large computer networks, or high-frequency financial data. We present favorable empirical results on synthetic data, and an application to clustering currency pairs via high-frequency price jumps.","2020","2023-11-01 21:29:20","2024-01-09 23:21:54","2023-11-01 21:29:20","1575-1579","","","27","","","","","","","","","","","","","","","IEEE Xplore","","Conference Name: IEEE Signal Processing Letters","","C:\Users\maroa\Zotero\storage\G74BAI7D\Türkmen et al. - 2020 - Clustering Event Streams With Low Rank Hawkes Proc.pdf; ","notion://www.notion.so/T-rkmen-et-al-2020-497869dc004241d7aac7a117ac267615","notion","","","","","","","","","","","","","","","","","","","","","","","","","","","","","","","","","","","","","","","","","","","","","","",""
"4QQDWIEX","journalArticle","2015","She, Yiyuan; He, Yuejia; Li, Shijie; Wu, Dapeng","Joint Association Graph Screening and Decomposition for Large-Scale Linear Dynamical Systems","IEEE Transactions on Signal Processing","","1941-0476","10.1109/TSP.2014.2373315","https://ieeexplore.ieee.org/document/6963432","This paper studies large-scale dynamical networks where the current state of the system is a linear transformation of the previous state, contaminated by a multivariate Gaussian noise. Examples include stock markets, human brains, and gene regulatory networks. We introduce a transition matrix to describe the evolution, which can be translated to a directed Granger transition graph, and use the concentration matrix of the Gaussian noise to capture the second-order relations between nodes, which can be translated to an undirected conditional dependence graph. We propose regularizing the two graphs jointly in topology identification and dynamics estimation. Based on the notion of joint association graph (JAG), we develop a joint graphical screening and estimation (JGSE) framework for efficient network learning in big data. In particular, our method can predetermine and remove unnecessary edges based on the joint graphical structure, referred to as JAG screening, and can decompose a large network into smaller subnetworks in a robust manner, referred to as JAG decomposition. JAG screening and decomposition can reduce the problem size and search space for fine estimation at a later stage. Experiments on both synthetic data and real-world applications show the effectiveness of the proposed framework in large-scale network topology identification and dynamics estimation.","2015-01","2023-11-01 21:43:28","2024-01-09 23:27:22","2023-11-01 21:43:28","389-401","","2","63","","","","","","","","","","","","","","","IEEE Xplore","","Conference Name: IEEE Transactions on Signal Processing","","C:\Users\maroa\Zotero\storage\9CH26VKU\She et al. - 2015 - Joint Association Graph Screening and Decompositio.pdf; ","notion://www.notion.so/She-et-al-2015-678bcb1e3f4c48bbac9b3896ca941aa6","notion","","","","","","","","","","","","","","","","","","","","","","","","","","","","","","","","","","","","","","","","","","","","","","",""
"WQL8UAIA","journalArticle","2016","Zhong, Tao; Peng, Qinke; Wang, Xiao; Zhang, Jing","Novel indexes based on network structure to indicate financial market","Physica A: Statistical Mechanics and its Applications","","0378-4371","10.1016/j.physa.2015.10.008","https://www.sciencedirect.com/science/article/pii/S0378437115008547","There have been various achievements to understand and to analyze the financial market by complex network model. However, current studies analyze the financial network model but seldom present quantified indexes to indicate or forecast the price action of market. In this paper, the stock market is modeled as a dynamic network, in which the vertices refer to listed companies and edges refer to their rank-based correlation based on price series. Characteristics of the network are analyzed and then novel indexes are introduced into market analysis, which are calculated from maximum and fully-connected subnets. The indexes are compared with existing ones and the results confirm that our indexes perform better to indicate the daily trend of market composite index in advance. Via investment simulation, the performance of our indexes is analyzed in detail. The results indicate that the dynamic complex network model could not only serve as a structural description of the financial market, but also work to predict the market and guide investment by indexes.","2016-02-01","2023-11-02 00:19:12","2024-01-09 23:38:08","2023-11-02 00:19:12","583-594","","","443","","Physica A: Statistical Mechanics and its Applications","","","","","","","","","","","","","ScienceDirect","","","","; C:\Users\maroa\Zotero\storage\DQTF6FSF\Zhong et al. - 2016 - Novel indexes based on network structure to indica.pdf; C:\Users\maroa\Zotero\storage\V8PH8T6P\S0378437115008547.html","notion://www.notion.so/Zhong-et-al-2016-212130153afc47f0b3ecc0a97edca963","notion","Network analysis; Maximum and fully-connected subnet; Structure-based index","","","","","","","","","","","","","","","","","","","","","","","","","","","","","","","","","","","","","","","","","","","","","",""
"9YX4ZIYH","journalArticle","2014","Fiedor, Paweł","Networks in financial markets based on the mutual information rate","Physical Review E","","","10.1103/PhysRevE.89.052801","https://link.aps.org/doi/10.1103/PhysRevE.89.052801","In the last few years there have been many efforts in econophysics studying how network theory can facilitate understanding of complex financial markets. These efforts consist mainly of the study of correlation-based hierarchical networks. This is somewhat surprising as the underlying assumptions of research looking at financial markets are that they are complex systems and thus behave in a nonlinear manner, which is confirmed by numerous studies, making the use of correlations which are inherently dealing with linear dependencies only baffling. In this paper we introduce a way to incorporate nonlinear dynamics and dependencies into hierarchical networks to study financial markets using mutual information and its dynamical extension: the mutual information rate. We show that this approach leads to different results than the correlation-based approach used in most studies, on the basis of 91 companies listed on the New York Stock Exchange 100 between 2003 and 2013, using minimal spanning trees and planar maximally filtered graphs.","2014-05-01","2023-11-02 01:05:47","2024-01-09 23:42:57","2023-11-02 01:05:47","052801","","5","89","","Phys. Rev. E","","","","","","","","","","","","","APS","","Publisher: American Physical Society","","C:\Users\maroa\Zotero\storage\63AH44VX\PhysRevE.89.html; ; C:\Users\maroa\Zotero\storage\Z5BRQJXG\Fiedor - 2014 - Networks in financial markets based on the mutual .pdf","notion://www.notion.so/Fiedor-2014-bf867a80b5014fd0bc7994842694a239","notion","","","","","","","","","","","","","","","","","","","","","","","","","","","","","","","","","","","","","","","","","","","","","","",""
"3Q5ZZGLG","journalArticle","2019","Engel, Janina; Pagano, Andrea; Scherer, Matthias","Reconstructing the topology of financial networks from degree distributions and reciprocity","Journal of Multivariate Analysis","","0047-259X","10.1016/j.jmva.2019.01.008","https://www.sciencedirect.com/science/article/pii/S0047259X18300903","A flexible probabilistic approach for the constructing of realistic topologies of interbank networks is presented. This constitutes a challenging task, since information on bilateral inter-banking activities is classified confidential and the number of banks in most European countries is substantial. First, we analyze what information on European inter-banking liabilities is publicly available. Second, we present an approach for the reconstruction of network topologies satisfying known characteristics through an exponential random graph model (ERGM), which incorporates the available information as side conditions. Third, we conduct a case study calibrating the model to the Italian and the German interbank market. Samples of both models are then analyzed with respect to different network statistics. The relevance of the presented results stems from the urgent need of having realistic instances of possible adjacency matrices as input in technical studies on the stability of inter-banking networks. Various such studies exist, however, most of them rely on toy models for the analyzed adjacency matrices.","2019-07-01","2023-11-02 19:11:46","2024-01-10 21:10:51","2023-11-02 19:11:46","210-222","","","172","","Journal of Multivariate Analysis","","Dependence Models","","","","","","","","","","","ScienceDirect","","","","; C:\Users\maroa\Zotero\storage\Z7PKDFZR\Engel et al. - 2019 - Reconstructing the topology of financial networks .pdf; C:\Users\maroa\Zotero\storage\Q9SSHNKX\S0047259X18300903.html","notion://www.notion.so/Engel-et-al-2019-17a8520797004d3bb0f70eadb705b99c","notion","Exponential random graph model; Financial network reconstruction; Maximum entropy","","","","","","","","","","","","","","","","","","","","","","","","","","","","","","","","","","","","","","","","","","","","","",""
"SECISPI4","preprint","2022","Wang, Jianian; Zhang, Sheng; Xiao, Yanghua; Song, Rui","A Review on Graph Neural Network Methods in Financial Applications","","","","","http://arxiv.org/abs/2111.15367","With multiple components and relations, financial data are often presented as graph data, since it could represent both the individual features and the complicated relations. Due to the complexity and volatility of the financial market, the graph constructed on the financial data is often heterogeneous or time-varying, which imposes challenges on modeling technology. Among the graph modeling technologies, graph neural network (GNN) models are able to handle the complex graph structure and achieve great performance and thus could be used to solve financial tasks. In this work, we provide a comprehensive review of GNN models in recent financial context. We first categorize the commonly-used financial graphs and summarize the feature processing step for each node. Then we summarize the GNN methodology for each graph type, application in each area, and propose some potential research areas.","2022-04-26","2023-11-02 19:32:06","2024-01-21 21:29:13","2023-11-02 19:32:06","","","","","","","","","","","","arXiv","","","","","","","arXiv.org","","arXiv:2111.15367 [cs, q-fin, stat]","","C:\Users\maroa\Zotero\storage\R8PPFPI2\2111.html; C:\Users\maroa\Zotero\storage\CK7FCIR9\Wang et al. - 2022 - A Review on Graph Neural Network Methods in Financ.pdf; ","notion://www.notion.so/Wang-et-al-2022-458199eb80e142e8b9bb0f9e396f0d5d","notion; Overview","Computer Science - Machine Learning; Quantitative Finance - Statistical Finance; Statistics - Applications","","","","","","","","","","","","","","","","","","","arXiv:2111.15367","","","","","","","","","","","","","","","","","","","","","","","","","","",""
"94TESFTZ","journalArticle","2021","Zhang, Zhiwei; Zhang, Dayong; Wu, Fei; Ji, Qiang","Systemic risk in the Chinese financial system: A copula-based network approach","International Journal of Finance & Economics","","1099-1158","10.1002/ijfe.1892","https://onlinelibrary.wiley.com/doi/abs/10.1002/ijfe.1892","This article examines the systemic risk in the Chinese financial system by combining copula and graph theory approaches. We start from identifying the interdependence amongst financial institutions based on static and dynamic copula functions. A minimum spanning tree is then generated to analyse the network structure in the financial system in both static and dynamic contexts. Evidence from both static and dynamic analysis verifies the systemic importance of Industrial Bank Co., Ltd. Some others, Shanghai Pudong Development Bank and Huaxia Bank Co., Limited, occasionally show systemic importance in the dynamic setting. We further examine the stability of the network structure and find that whilst the dependence structure exhibits time-varying patterns, certain relationships appear to be more stable than others. Our findings hold important policy and investment implications.","2021","2023-11-02 20:14:42","2024-01-10 21:21:59","2023-11-02 20:14:42","2044-2063","","2","26","","","Systemic risk in the Chinese financial system","","","","","","","en","© 2020 John Wiley & Sons, Ltd.","","","","Wiley Online Library","","_eprint: https://onlinelibrary.wiley.com/doi/pdf/10.1002/ijfe.1892","","C:\Users\maroa\Zotero\storage\UKSAJQ45\Zhang et al. - 2021 - Systemic risk in the Chinese financial system A c.pdf; ","notion://www.notion.so/Zhang-et-al-2021-c98cde9bd433484ab1b16573acd10161","notion","copula; financial system; minimum spanning tree; systemically important financial institution","","","","","","","","","","","","","","","","","","","","","","","","","","","","","","","","","","","","","","","","","","","","","",""
"8D9TR5F9","journalArticle","2016","Amini, Hamed; Cont, Rama; Minca, Andreea","Resilience to Contagion in Financial Networks","Mathematical Finance","","1467-9965","10.1111/mafi.12051","https://onlinelibrary.wiley.com/doi/abs/10.1111/mafi.12051","We derive rigorous asymptotic results for the magnitude of contagion in a large counterparty network and give an analytical expression for the asymptotic fraction of defaults, in terms of network characteristics. Our results extend previous studies on contagion in random graphs to inhomogeneous-directed graphs with a given degree sequence and arbitrary distribution of weights. We introduce a criterion for the resilience of a large financial network to the insolvency of a small group of financial institutions and quantify how contagion amplifies small shocks to the network. Our results emphasize the role played by “contagious links” and show that institutions which contribute most to network instability have both large connectivity and a large fraction of contagious links. The asymptotic results show good agreement with simulations for networks with realistic sizes.","2016","2023-11-02 20:29:04","2024-01-10 21:25:21","2023-11-02 20:29:04","329-365","","2","26","","","","","","","","","","en","© 2016 The Authors. Mathematical Finance Published by Wiley Periodicals, Inc.","","","","Wiley Online Library","","_eprint: https://onlinelibrary.wiley.com/doi/pdf/10.1111/mafi.12051","","C:\Users\maroa\Zotero\storage\AY8NRDWJ\Amini et al. - 2016 - Resilience to Contagion in Financial Networks.pdf; ","notion://www.notion.so/Amini-et-al-2016-491d192d7bb04fe0b81250e57adff61d","notion","systemic risk; financial stability; interbank network; default contagion; macroprudential regulation; random graphs","","","","","","","","","","","","","","","","","","","","","","","","","","","","","","","","","","","","","","","","","","","","","",""
"G28V2CYU","preprint","2008","Nier, Erlend W.; Yang, Jing; Yorulmazer, Tanju; Alentorn, Amadeo","Network Models and Financial Stability","","","","10.2139/ssrn.1280788","https://papers.ssrn.com/abstract=1280788","Systemic risk is a key concern for central banks charged with safeguarding overall financial stability. In this paper we investigate how systemic risk is affected by the structure of the financial system. We construct banking systems that are composed of a number of banks that are connected by interbank linkages. We then vary the key parameters that define the structure of the financial system - including its level of capitalisation, the degree to which banks are connected, the size of interbank exposures and the degree of concentration of the system - and analyse the influence of these parameters on the likelihood of contagious (knock-on) defaults. First, we find that the better capitalised banks are, the more resilient is the banking system against contagious defaults and this effect is non-linear. Second, the effect of the degree of connectivity is non-monotonic, that is, initially a small increase in connectivity increases the contagion effect; but after a certain threshold value, connectivity improves the ability of a banking system to absorb shocks. Third, the size of interbank liabilities tends to increase the risk of knock-on default, even if banks hold capital against such exposures. Fourth, more concentrated banking systems are shown to be prone to larger systemic risk, all else equal. In an extension to the main analysis we study how liquidity effects interact with banking structure to produce a greater chance of systemic breakdown. We finally consider how the risk of contagion might depend on the degree of asymmetry (tiering) inherent in the structure of the banking system. A number of our results have important implications for public policy, which this paper also draws out.","2008-04-01","2023-11-02 21:02:52","2024-01-10 21:32:53","2023-11-02 21:02:52","","","","","","","","","","","","","Rochester, NY","en","","SSRN Scholarly Paper","","","Social Science Research Network","","","","C:\Users\maroa\Zotero\storage\C3JLIIFS\Nier et al. - 2008 - Network Models and Financial Stability.pdf; ","notion://www.notion.so/Nier-et-al-2008-c3be98518acd4b9d8002972c2f53d886","notion","contagion; financial stability; Networks; liquidity risk","","","","","","","","","","","","","","","","","","","1280788","","","","","","","","","","","","","","","","","","","","","","","","","","",""
"CZFK22JG","journalArticle","2014","Sachs, Angelika","Completeness, interconnectedness and distribution of interbank exposures—a parameterized analysis of the stability of financial networks","Quantitative Finance","","1469-7688","10.1080/14697688.2012.749421","https://doi.org/10.1080/14697688.2012.749421","This paper assesses the impact of a certain structure of interbank exposures on the stability of a stylized financial system. Given a certain balance sheet structure of financial institutions, a large number of valid matrices of interbank exposures is created by a random generator. Assuming a certain loss given default, domino effects are simulated. The main results are, first, that financial stability depends not only on the completeness and interconnectedness of the network, but also on the distribution of interbank exposures within the system (measured by entropy). Second, looking at random graphs, the sign of the correlation between the degree of equality of the distribution of claims and financial stability depends on the connectivity of the financial system as well as on additional parameters that affect the vulnerability of the system to interbank contagion. Third, the more concentrated the assets are within a money center model, the less stable it is. Fourth, a money center model with asset concentration among core banks is less stable than a random graph with banks of homogeneous size.","2014-09-01","2023-11-02 21:16:06","2024-01-10 21:38:55","2023-11-02 21:16:06","1677-1692","","9","14","","","","","","","","","","","","","","","Taylor and Francis+NEJM","","Publisher: Routledge _eprint: https://doi.org/10.1080/14697688.2012.749421","","C:\Users\maroa\Zotero\storage\5JQCTT62\Sachs - 2014 - Completeness, interconnectedness and distribution .pdf; ","notion://www.notion.so/Sachs-2014-09d3c36a4f46404fbbc96a07c61e4ea1","notion","Contagion; C63; Domino effects; Financial stability; G21; G28; Interbank lending","","","","","","","","","","","","","","","","","","","","","","","","","","","","","","","","","","","","","","","","","","","","","",""
"7I5KKW77","journalArticle","2018","Demirer, Mert; Diebold, Francis X.; Liu, Laura; Yilmaz, Kamil","Estimating global bank network connectedness","Journal of Applied Econometrics","","1099-1255","10.1002/jae.2585","https://onlinelibrary.wiley.com/doi/abs/10.1002/jae.2585","We use LASSO methods to shrink, select, and estimate the high-dimensional network linking the publicly traded subset of the world's top 150 banks, 2003–2014. We characterize static network connectedness using full-sample estimation and dynamic network connectedness using rolling-window estimation. Statically, we find that global bank equity connectedness has a strong geographic component, whereas country sovereign bond connectedness does not. Dynamically, we find that equity connectedness increases during crises, with clear peaks during the Great Financial Crisis and each wave of the subsequent European Debt Crisis, and with movements coming mostly from changes in cross-country as opposed to within-country bank linkages.","2018","2023-11-02 21:21:00","2024-02-14 22:34:44","2023-11-02 21:20:59","1-15","","1","33","","","","","","","","","","en","Copyright © 2017 John Wiley & Sons, Ltd.","","","","Wiley Online Library","","_eprint: https://onlinelibrary.wiley.com/doi/pdf/10.1002/jae.2585","","C:\Users\maroa\Zotero\storage\NB2CW77W\Demirer et al. - 2018 - Estimating global bank network connectedness.pdf; C:\Users\maroa\Zotero\storage\XLBMGMSS\Demirer et al. - 2018 - Estimating global bank network connectedness.pdf; ; C:\Users\maroa\Zotero\storage\9GGP4TNU\jae.html","notion://www.notion.so/Demirer-et-al-2018-b187f258a06c4549a11d513e4caf6216","notion","","","","","","","","","","","","","","","","","","","","","","","","","","","","","","","","","","","","","","","","","","","","","","",""
"MT9AUC8F","journalArticle","2010","Gai, Prasanna; Kapadia, Sujit","Contagion in financial networks","Proceedings of the Royal Society A: Mathematical, Physical and Engineering Sciences","","","10.1098/rspa.2009.0410","https://royalsocietypublishing.org/doi/abs/10.1098/rspa.2009.0410","This paper develops an analytical model of contagion in financial networks with arbitrary structure. We explore how the probability and potential impact of contagion is influenced by aggregate and idiosyncratic shocks, changes in network structure and asset market liquidity. Our findings suggest that financial systems exhibit a robust-yet-fragile tendency: while the probability of contagion may be low, the effects can be extremely widespread when problems occur. And we suggest why the resilience of the system in withstanding fairly large shocks prior to 2007 should not have been taken as a reliable guide to its future robustness.","2010-03-24","2023-11-02 22:01:49","2024-01-10 21:51:49","2023-11-02 22:01:48","2401-2423","","2120","466","","","","","","","","","","","","","","","royalsocietypublishing.org (Atypon)","","Publisher: Royal Society","","C:\Users\maroa\Zotero\storage\JFNCBMU6\Gai and Kapadia - 2010 - Contagion in financial networks.pdf; ","notion://www.notion.so/Gai-Kapadia-2010-01faa1384947495cb1831e52949cba9c","notion","systemic risk; contagion; liquidity risk; financial crises; network models","","","","","","","","","","","","","","","","","","","","","","","","","","","","","","","","","","","","","","","","","","","","","",""
